{
  "schema_version": 1,
  "kind": "ArchitectureDriver",
  "id": "DRV-SOURCE-RUNTIME-POST-FORM-001",
  "revision": 1,
  "status": "proposed",
  "semantic_key": "source.execution.post-form-independent-runtime",
  "title": "以独立 SourceRuntime 承载确定性 POST Form 请求语义",
  "claim_refs": [
    {
      "id": "BKC-SR-POST-FORM-REQUEST-001",
      "revision": 1
    },
    {
      "id": "BKC-SR-POST-FORM-BOUNDARY-001",
      "revision": 1
    }
  ],
  "forces": [
    {
      "quality_attribute": "compatibility",
      "scenario": "POST Form 的 method、字段次序、percent-encoded 值、空值和重复 key last-wins 必须与受保护 Android Golden 逐字段一致。",
      "criticality": "critical"
    },
    {
      "quality_attribute": "determinism",
      "scenario": "相同书源 URL option 与变量输入必须先生成可 canonicalize 的 RequestPlan；表单字段和 body 的确定性结果可由 SourceLab、CLI 与测试共同消费。",
      "criticality": "critical"
    },
    {
      "quality_attribute": "isolation",
      "scenario": "请求语义由独立 SourceRuntime 编译，实际发送由 Transport 端口执行；UI、Domain 与书源编辑器不能依赖 URLSession、OkHttp 或 WebView 类型。",
      "criticality": "critical"
    },
    {
      "quality_attribute": "evolvability",
      "scenario": "raw body、JSON、XML、Cookie、retry 与 WebView 必须通过各自的 Android Golden 切片扩展，不能从 POST Form 场景推定或污染当前合同。",
      "criticality": "high"
    },
    {
      "quality_attribute": "observability",
      "scenario": "验收输出必须包含 Android expected、iOS actual、canonical RequestPlan 与 first-divergence，不能只以网络请求成功替代语义对齐。",
      "criticality": "high"
    }
  ],
  "decision_questions": [
    "RequestPlan 如何无损表达 form_fields 的稳定次序，同时使 body 编码保持可复现？",
    "Transport 如何消费 RequestPlan 而不重新解释或改写已经由 SourceRuntime 确定的 POST Form 语义？",
    "未来 raw、JSON、XML 与 WebView 请求语义如何以独立能力切片加入而不扩大当前已验证边界？"
  ],
  "resolution": {
    "state": "resolved",
    "adr_refs": [
      "ADR-0001",
      "ADR-0002"
    ],
    "work_item_refs": [
      "IOS-KNOWLEDGE-SOURCE-RUNTIME-POST-FORM-001"
    ]
  },
  "promotion": null,
  "supersedes": null,
  "created_by": "IOS-KNOWLEDGE-SOURCE-RUNTIME-POST-FORM-001"
}
